{
  "$schema": "http://json-schema.org/draft-07/schema#",
  "$id": "https://raw.githubusercontent.com/Utopia-USS/utopia-ui/main/protocol/schemas/manifest.schema.json",
  "title": "Utopia Design Protocol - component manifest",
  "description": "Machine-readable API registry of a utopia_ui release, a consumer project's custom components (project manifest), or the merged view of both. Components are concrete widgets (library: exported from the barrel; project: opt-in via overlay), plus models (data classes used in props) and helpers (functions, hooks, typedefs). Modeled on custom-elements-manifest, adapted to Flutter. Protocol version 0.4.0; see protocol/VERSIONING.md and SPEC.md 3.8.",
  "type": "object",
  "properties": {
    "$schema": { "type": "string" },
    "schemaVersion": {
      "type": "string",
      "pattern": "^[0-9]+\\.[0-9]+\\.[0-9]+$",
      "description": "Version of the manifest schema (the protocol version) this document conforms to."
    },
    "package": {
      "type": "string",
      "pattern": "^[a-z][a-z0-9_]*$",
      "description": "The Dart package this manifest describes: \"utopia_ui\" for the shipped library manifest, the project's package name for project and merged manifests (SPEC 3.8)."
    },
    "packageVersion": {
      "type": "string",
      "description": "Version of the described package, stamped from pubspec.yaml at generation time. For the library manifest it MUST match the consumer's resolved utopia_ui version (drift gate)."
    },
    "utopiaUiVersion": {
      "type": "string",
      "description": "The resolved utopia_ui version this document was generated against. REQUIRED on project and merged manifests (SPEC 3.8 freshness gate); absent on the library manifest itself."
    },
    "merged": {
      "type": "boolean",
      "description": "True on the derived merged view (library + project components in one file). Merged manifests are regenerated, never edited, never a source of truth (SPEC 3.8)."
    },
    "generatedAt": {
      "type": "string",
      "description": "ISO 8601 generation timestamp."
    },
    "components": {
      "type": "array",
      "items": { "$ref": "#/definitions/component" }
    },
    "models": {
      "type": "array",
      "items": { "$ref": "#/definitions/model" }
    },
    "helpers": {
      "type": "array",
      "items": { "$ref": "#/definitions/helper" }
    }
  },
  "required": ["schemaVersion", "package", "packageVersion", "components"],
  "additionalProperties": false,
  "definitions": {
    "kebabId": {
      "type": "string",
      "pattern": "^([a-z][a-z0-9_]*:)?[a-z][a-z0-9]*(-[a-z0-9]+)*$",
      "description": "Component id: bare kebab-case for utopia_ui library components; '<packageName>:<kebab-name>' for project components (SPEC 3.3)."
    },
    "dartName": {
      "type": "string",
      "pattern": "^[A-Za-z_][A-Za-z0-9_]*$"
    },
    "portableType": {
      "type": "string",
      "enum": [
        "string", "number", "bool", "enum", "color", "duration", "date",
        "callback", "widget-slot", "builder-slot", "list", "generic-model",
        "model", "other"
      ],
      "description": "Portable prop type vocabulary (SPEC.md 3.5). The verbatim Dart type always travels alongside in dartType."
    },
    "prop": {
      "type": "object",
      "properties": {
        "name": { "$ref": "#/definitions/dartName" },
        "type": { "$ref": "#/definitions/portableType" },
        "dartType": {
          "type": "string",
          "description": "Verbatim Dart type of the parameter, e.g. \"void Function(String?)\"."
        },
        "required": { "type": "boolean" },
        "default": {
          "type": "string",
          "description": "Verbatim Dart default expression, e.g. \"false\", \"const []\". Absent when the parameter has no default."
        },
        "description": { "type": "string" },
        "enumName": {
          "$ref": "#/definitions/dartName",
          "description": "For type \"enum\": the Dart enum's name."
        },
        "values": {
          "type": "array",
          "items": { "type": "string" },
          "description": "For type \"enum\": the enum's value names."
        },
        "itemType": {
          "$ref": "#/definitions/portableType",
          "description": "For type \"list\": portable type of the list elements."
        },
        "itemDartType": {
          "type": "string",
          "description": "For type \"list\": verbatim Dart type of the list elements."
        },
        "modelName": {
          "$ref": "#/definitions/dartName",
          "description": "For type \"model\" (or list of models): the referenced entry in the models section."
        }
      },
      "required": ["name", "type", "dartType", "required"],
      "additionalProperties": false
    },
    "constructor": {
      "type": "object",
      "properties": {
        "name": {
          "type": "string",
          "pattern": "^([a-z][A-Za-z0-9_]*)?$",
          "description": "Named-constructor name; empty string for the unnamed constructor."
        },
        "description": { "type": "string" },
        "props": {
          "type": "array",
          "items": { "$ref": "#/definitions/prop" }
        }
      },
      "required": ["name", "props"],
      "additionalProperties": false
    },
    "tokenBindingPath": {
      "type": "string",
      "pattern": "^(colors|textStyles|theme|tokens)(\\.[a-zA-Z][a-zA-Z0-9]*)+$",
      "description": "Dotted UtopiaThemeData member path the component reads, e.g. \"colors.primary\", \"tokens.durations.xs\", \"theme.borderRadius\"."
    },
    "tokenBindingOrigin": {
      "type": "string",
      "enum": ["source", "overlay"],
      "description": "Provenance of the binding (SPEC 3.6): \"source\" = derived from the component's own Dart implementation by the extractor; \"overlay\" = declared by the overlay's tokenBindingsAdd escape hatch, which the extractor cannot see. Optional: documents written for an older minor carry bare-string bindings with no provenance at all, and a generator that cannot tell the two apart must be able to stay silent rather than guess. Every generator in this repo stamps it (SPEC 3.7), which is what lets validate_manifest verify a shipped manifest's bindings without the overlay directory the pub tarball does not ship.",
      "default": "source"
    },
    "tokenBinding": {
      "description": "One tokenBindings entry. Since protocol 0.3.0 an object carrying the dotted path plus its origin; the bare-string form written by 0.2 generators stays valid (VERSIONING.md: documents written for an older minor remain valid) and is read as a path of unknown origin.",
      "oneOf": [
        { "$ref": "#/definitions/tokenBindingPath" },
        {
          "type": "object",
          "properties": {
            "path": { "$ref": "#/definitions/tokenBindingPath" },
            "origin": { "$ref": "#/definitions/tokenBindingOrigin" }
          },
          "required": ["path"],
          "additionalProperties": false
        }
      ]
    },
    "state": {
      "type": "string",
      "enum": [
        "hover", "focus", "pressed", "loading", "disabled", "selected",
        "error", "empty", "readOnly", "expanded", "open", "on"
      ]
    },
    "component": {
      "type": "object",
      "properties": {
        "id": {
          "$ref": "#/definitions/kebabId",
          "description": "Stable id: class name minus the Utopia prefix, kebab-cased. Unique across the manifest."
        },
        "name": { "$ref": "#/definitions/dartName" },
        "description": { "type": "string" },
        "file": {
          "type": "string",
          "pattern": "^lib/",
          "description": "Repo-relative source path."
        },
        "generic": {
          "type": "boolean",
          "description": "True when the widget is generic over a row/item type T."
        },
        "constructors": {
          "type": "array",
          "items": { "$ref": "#/definitions/constructor" },
          "minItems": 1
        },
        "tokenBindings": {
          "type": "array",
          "items": { "$ref": "#/definitions/tokenBinding" }
        },
        "states": {
          "type": "array",
          "items": { "$ref": "#/definitions/state" }
        },
        "composes": {
          "type": "array",
          "items": { "$ref": "#/definitions/kebabId" },
          "description": "Ids of other manifest components this component renders internally."
        },
        "twin": {
          "type": "object",
          "description": "Where this component is rendered in the HTML twin (SPEC 4.4). Emitted by the generator exactly for the ids that carry a data-utopia-id section in the twin bundle; absent for components with no twin section.",
          "properties": {
            "file": {
              "type": "string",
              "description": "Twin-bundle-relative file name (SPEC 4.1 layout), e.g. \"components.html\" - resolved against the twin/ directory of the package the manifest describes."
            },
            "selector": {
              "type": "string",
              "description": "CSS selector for the component's root element in that file, e.g. \"[data-utopia-id=\\\"button\\\"]\"."
            }
          },
          "required": ["file", "selector"],
          "additionalProperties": false
        },
        "examples": {
          "type": "array",
          "items": { "type": "string" },
          "description": "Repo-relative paths demonstrating the component (example app sections)."
        },
        "notes": {
          "type": "string",
          "description": "Curated semantic notes from the overlay (usage guidance an analyzer cannot derive)."
        }
      },
      "required": ["id", "name", "description", "file", "constructors", "tokenBindings"],
      "additionalProperties": false
    },
    "model": {
      "type": "object",
      "properties": {
        "name": { "$ref": "#/definitions/dartName" },
        "description": { "type": "string" },
        "file": { "type": "string", "pattern": "^lib/" },
        "kind": {
          "type": "string",
          "enum": ["class", "sealed-class", "enum", "record"],
          "description": "Dart declaration kind. Sealed hierarchies list subtypes as separate model entries whose supertype names the sealed parent."
        },
        "supertype": {
          "$ref": "#/definitions/dartName",
          "description": "For subtypes of a sealed hierarchy: the sealed parent's name."
        },
        "values": {
          "type": "array",
          "items": { "type": "string" },
          "description": "For kind \"enum\": the value names."
        },
        "constructors": {
          "type": "array",
          "items": { "$ref": "#/definitions/constructor" }
        }
      },
      "required": ["name", "description", "file", "kind"],
      "additionalProperties": false
    },
    "helper": {
      "type": "object",
      "properties": {
        "name": { "$ref": "#/definitions/dartName" },
        "kind": {
          "type": "string",
          "enum": ["function", "hook", "typedef", "extension"]
        },
        "description": { "type": "string" },
        "file": { "type": "string", "pattern": "^lib/" },
        "signature": {
          "type": "string",
          "description": "Verbatim declaration signature."
        }
      },
      "required": ["name", "kind", "description", "file"],
      "additionalProperties": false
    }
  }
}
